complaint_id,timestamp,text_length,gemini_analysis,risk_score
11310670,2025-12-03T16:08:35.797315,1541,"{""scam_probability"": 95, ""scam_type"": {""primary_category"": ""Fake Placement/Staffing Scams"", ""subcategory"": ""Impersonation Scam""}, ""red_flags"": {""communication"": [""Contacted by a company claiming to be XXXX, but later confirmed by the actual XXXX owner to be an impersonation.""], ""financial"": [""Required to send money under false pretenses for the job."", ""Expected compensation was never received."", ""Scammed out of a significant amount of money.""], ""job_posting"": [""Job involved tasks that might be a precursor to financial manipulation (setting/reviewing albums/singles can be vague).""], ""hiring_process"": [""The process involved communication with alleged representatives, indicating a potential intermediary or fake hiring team."", ""The ultimate denial by the bank due to 'inconsistencies' suggests a sophisticated scam designed to avoid clear traceable patterns or that the victim may have inadvertently facilitated the scam by making payments.""], ""work_activity"": [""Tasks described (completing sets and reviewing albums and singles) are somewhat vague and could be used to legitimize requests for funds.""]}, ""financial_risk"": {""level"": ""Critical"", ""potential_loss"": ""{[AMOUNT]}"", ""explanation"": ""The victim lost a significant amount of money, and their bank claim was denied, indicating a high likelihood of permanent loss unless further action is taken.""}, ""victim_profile"": {""vulnerability_factors"": [""Seeking remote work, which can be a common target for scams."", ""Trust in a company name, even when it turned out to be an impersonation."", ""Potential misunderstanding of the bank's denial reason, possibly due to not fully grasping the nuances of the scam's financial mechanics.""], ""risk_level"": ""High""}, ""evidence_strength"": ""Moderate"", ""recommendations"": {""immediate_actions"": [""Gather all communication records (emails, texts, chat logs) with the alleged scammer."", ""Collect all transaction details related to the money sent, including bank statements and reference numbers."", ""Obtain any documentation or proof of the alleged job tasks completed."", ""Request a detailed written explanation from Santander regarding the 'inconsistencies' that led to the claim denial. This is crucial for understanding the bank's perspective and identifying potential gaps in the evidence or the scammer's methods.""], ""verification_steps"": [""Contact the actual owner of XXXX again to see if they have any information on the impersonators or a history of such scams targeting their brand. They might have reporting channels or advisories for their customers."", ""Thoroughly review the bank's 'inconsistencies' with a financial crime expert or legal advisor. The bank might have specific criteria for fraud claims that were not met, and understanding these could be key to appealing the decision."", ""Research common impersonation scams targeting companies in the music/entertainment industry, as this might reveal patterns of operation for the scammers.""], ""reporting"": [""Continue to cooperate fully with law enforcement and provide them with all gathered evidence."", ""Consider filing a complaint with the relevant consumer protection agencies (e.g., FTC in the US, Action Fraud in the UK, or equivalent in the victim's region)."", ""If the scam involved international transactions, consider reporting to international fraud bodies."", ""If the impersonation was widespread or affected multiple individuals, the victim's report could contribute to a larger investigation.""]}, ""confidence"": 98}",95
11258229,2025-12-03T16:08:38.829756,1219,"{""scam_probability"": 95, ""scam_type"": {""primary_category"": ""Financial Mark Scams"", ""subcategory"": ""Fake Check/Advance Fee Scam""}, ""red_flags"": {""communication"": [""Pushy insistence on depositing a check and transferring funds immediately."", ""Unusual urgency related to holidays and work environment.""], ""financial"": [""Receiving a check for 'remote equipment' before starting work."", ""Being instructed to transfer funds to a 'fake vendor'.""], ""job_posting"": [], ""hiring_process"": [""Use of seemingly legitimate documentation (company name, HR persona)."", ""High-pressure tactics to proceed with financial transactions.""], ""work_activity"": [""The 'nature of work environment' being used as justification for an unusual financial transaction.""]}, ""financial_risk"": {""level"": ""High"", ""potential_loss"": ""{[AMOUNT]}"", ""explanation"": ""The victim sent money to a fake vendor for equipment as instructed after depositing a fraudulent check. The money sent is a direct financial loss.""}, ""victim_profile"": {""vulnerability_factors"": [""Seeking employment in the current economy (suggests potential financial need or desperation)."", ""Initiated due diligence by verifying linked accounts and calling the bank (shows effort but was ultimately misled)."", ""Believed a persona acting like a 'big HR person' from a known company.""], ""risk_level"": ""Medium""}, ""evidence_strength"": ""Strong"", ""recommendations"": {""immediate_actions"": [""Continue to cooperate fully with all government agencies (FBI IC3, FTC, DFPI) where the report was filed."", ""Gather and organize all records, messages, documentation, and voice recordings as evidence.""], ""verification_steps"": [""While PayPal stated nothing could be done, re-engage with PayPal support to understand the specific reasons and if any internal investigation is possible."", ""Contact Assurant directly (using official channels, not provided by the scammer) to report the impersonation and potential misuse of their company name.""], ""reporting"": [""Ensure all relevant details are provided to the FBI IC3, FTC, and DFPI, including the scammer's contact information, the fake vendor's information, and any transaction details."", ""Consider reporting to the local police department where the victim resides, as they may have jurisdiction or resources for investigation.""]}, ""confidence"": 98}",95
11629506,2025-12-03T16:08:41.690121,1669,"{""scam_probability"": 100, ""scam_type"": {""primary_category"": ""Financial Mark Scams"", ""subcategory"": ""Fake Check Scam""}, ""red_flags"": {""communication"": [""Initial contact via college email (potential for spoofing)"", ""No formal interview process"", ""Urgency to proceed with transactions despite bank delays"", ""Sender disappeared after the scam was discovered""], ""financial"": [""Checks sent via email for deposit"", ""Victim asked to deposit checks and purchase materials themselves"", ""Victim asked to send money from savings to cover purchases"", ""Victim's account depleted, checks were fake""], ""job_posting"": [""Unsolicited summer internship offer via email""], ""hiring_process"": [""Absence of formal interview or vetting process"", ""Introduction of a 'materials manager' via message"", ""Instructions to deposit checks and purchase items""], ""work_activity"": [""No actual work described or performed beyond purchasing materials""]}, ""financial_risk"": {""level"": ""Critical"", ""potential_loss"": ""All savings, money from fake checks, overdraft fees"", ""explanation"": ""The scammer leveraged fake checks to drain the victim's accounts and likely used the deposited funds to cover the fake check's bounce, leaving the victim with a significant deficit.""}, ""victim_profile"": {""vulnerability_factors"": [""Student needing to pay off student bills (financial pressure)"", ""Lack of prior experience with job scams or financial fraud"", ""Trusting an unsolicited offer received via college email"", ""Not questioning the unusual payment method initially""], ""risk_level"": ""High""}, ""evidence_strength"": ""Strong"", ""recommendations"": {""immediate_actions"": [""Continue to cooperate with any ongoing investigations by law enforcement.""], ""verification_steps"": [""No further verification steps for this specific incident are applicable, as it has already concluded negatively.""], ""reporting"": [""Ensure thorough documentation of all communications and transactions."", ""Consider filing a report with the FBI's Internet Crime Complaint Center (IC3)."", ""If the bank is a member of the FDIC, report the fraud to them."", ""Explore consumer protection agencies in your state or region.""]}, ""confidence"": 100}",100
11338911,2025-12-03T16:08:44.352681,1428,"{""scam_probability"": 95, ""scam_type"": {""primary_category"": ""Financial Mark Scams"", ""subcategory"": ""Fake Check Scam""}, ""red_flags"": {""communication"": [""Initial contact via email from an unspecified account."", ""Lack of direct, personal interaction with the hiring manager or HR."", ""Unresponsive contact person after the scam was discovered.""], ""financial"": [""Request for payment for internship materials."", ""Issuance of digital checks for the purchase of materials."", ""Requirement to deposit digital checks and pay out-of-pocket due to processing delays."", ""Issuance of a 'reimbursement' digital check for funds paid out-of-pocket."", ""Sudden notification of insufficient balance leading to total loss of savings."", ""Fake checks that eventually bounce or are revealed as fraudulent.""], ""job_posting"": [""The job was obtained via email solicitation, not a formal job posting.""], ""hiring_process"": [""Rapid progression from initial contact to payment requests without formal interviews or background checks."", ""The process relied on digital communication and check manipulation."", ""No clear indication of the company's legitimacy or physical location.""], ""work_activity"": [""The nature of the 'internship' or 'work activity' is not described, which is common in scams to keep the victim disengaged from the core fraudulent activity.""]}, ""financial_risk"": {""level"": ""Critical"", ""potential_loss"": ""All savings"", ""explanation"": ""The scam led to the complete depletion of the victim's savings, a critical financial loss.""}, ""victim_profile"": {""vulnerability_factors"": [""Seeking summer employment/internship opportunities."", ""Trusting the legitimacy of initial communication."", ""Financial need or desire to earn money during the summer."", ""Reliance on digital transactions and quick processes.""], ""risk_level"": ""Medium""}, ""evidence_strength"": ""Strong"", ""recommendations"": {""immediate_actions"": [""Continue cooperating with the bank and any fraud investigation units."", ""Change passwords for all online accounts, especially banking and email.""], ""verification_steps"": [""Do not engage with any further unsolicited communications related to this incident."", ""Review all bank statements for any unauthorized transactions, beyond the initial fraud.""], ""reporting"": [""Report the incident to the FBI's Internet Crime Complaint Center (IC3)."", ""Report to the Federal Trade Commission (FTC).""]}, ""confidence"": 98}",95
11582419,2025-12-03T16:08:46.811503,636,"{""scam_probability"": 95, ""scam_type"": {""primary_category"": ""Financial Mark Scams"", ""subcategory"": ""Fake Check/Advance Fee Scam""}, ""red_flags"": {""communication"": [], ""financial"": [""Involvement of Zelle for payments related to equipment purchases"", ""Use of fake checks to fund supposed work-related purchases"", ""Victim asked to purchase equipment upfront""], ""job_posting"": [], ""hiring_process"": [""Company claimed they see this scam 'all the time' but had no safety features""], ""work_activity"": [""Requirement to purchase equipment as a prerequisite for starting work""]}, ""financial_risk"": {""level"": ""High"", ""potential_loss"": ""{[AMOUNT]}"", ""explanation"": ""The victim lost a significant sum of money due to fake checks and the need to purchase equipment. This type of scam often involves victims paying for goods or services that are never delivered or are worthless.""}, ""victim_profile"": {""vulnerability_factors"": [""Actively seeking employment ('avidly trying to get a XXXX XXXX XXXX XXXX')"", ""Trusting the company's process for acquiring necessary equipment""], ""risk_level"": ""Medium""}, ""evidence_strength"": ""Strong"", ""recommendations"": {""immediate_actions"": [""Report the scam to Zelle and the bank that processed the transactions."", ""File a police report with local law enforcement.""], ""verification_steps"": [""Never cash or deposit fake checks."", ""Always verify the legitimacy of a company and its hiring process through independent channels (e.g., company website, LinkedIn, BBB)."", ""Be wary of any job that requires you to pay for equipment or supplies upfront, especially through payment apps like Zelle.""], ""reporting"": [""Report to the Federal Trade Commission (FTC) at ReportFraud.ftc.gov."", ""Report to the FBI's Internet Crime Complaint Center (IC3).""]}, ""confidence"": 98}",95
11913356,2025-12-03T16:08:50.489444,3015,"{""scam_probability"": 95, ""scam_type"": {""primary_category"": ""Financial Mark Scams"", ""subcategory"": ""Fake Check Scam / Advance Fee Scam""}, ""red_flags"": {""communication"": [""Approached by an individual claiming to work for a company without clear verification of their identity."", ""Went dark and lost contact after the scam was revealed."", ""Insisted on specific methods of communication (text, email) which can be less traceable."", ""Provided a fake document supposedly from the school.""], ""financial"": [""Provided a check in advance for services."", ""Asked to cash the check digitally and then send money back."", ""The advance check was fake and reversed."", ""Victim lost money sent back before the fake check bounced."", ""Bank denied claim despite documented proof, suggesting the scam was sophisticated enough to circumvent initial bank processes.""], ""job_posting"": [""Approached unsolicited, suggesting the initial contact might not be a legitimate job posting.""], ""hiring_process"": [""Received a check before any work was completed or validated."", ""The scammer insisted on paying the full amount upfront."", ""Pressure to cash the check digitally immediately."", ""Claimed the project was being canceled in phases and requested money back."", ""Used a fake document to justify the cancellation and money return request.""], ""work_activity"": [""The project began to be canceled in phases shortly after receiving the check."", ""The scammer claimed less work would be involved after the check was cashed.""]}, ""financial_risk"": {""level"": ""High"", ""potential_loss"": ""{[AMOUNT]} (initial fake check amount) + {[AMOUNT]} (sent back) = Total loss of at least {[AMOUNT]}"", ""explanation"": ""The victim was defrauded by a fake check and then tricked into sending their own money back to the scammer before the check bounced, resulting in a double loss.""}, ""victim_profile"": {""vulnerability_factors"": [""Trusting the initial contact as legitimate."", ""Pressure to act quickly by cashing the check and sending funds back."", ""Lack of experience with this type of scam.""], ""risk_level"": ""Medium""}, ""evidence_strength"": ""Strong"", ""recommendations"": {""immediate_actions"": [""Do not engage further with the scammer."", ""Document all communications, transactions, and any financial losses.""], ""verification_steps"": [""Contact the purported company directly through official channels (website, publicly listed phone number) to verify the legitimacy of the individual and the job offer."", ""If a bank denies a claim, understand the appeal process and provide all possible evidence.""], ""reporting"": [""File a police report with local law enforcement."", ""Report the scam to the Federal Trade Commission (FTC) at ReportFraud.ftc.gov."", ""Report the scam to the FBI's Internet Crime Complaint Center (IC3) at ic3.gov."", ""Contact the bank to ensure all avenues of recourse are exhausted, including providing additional evidence for their internal review or appeal process."", ""If a specific platform or website was used for initial contact, report the scam there.""]}, ""confidence"": 98}",95
