complaint_id,timestamp,text_length,gemini_analysis,risk_score
5187241,2025-12-03T15:41:30.799669,910,"{""scam_probability"": 95, ""scam_type"": {""primary_category"": ""Financial Mark Scams"", ""subcategory"": ""Fake Check Scam""}, ""red_flags"": {""communication"": [""Unsolicited email from a prospective employer."", ""Use of a personal email address (likely) instead of a company domain."", ""Claims of employment with a government agency and a university simultaneously, which is unlikely."", ""Vague description of the job duties.""], ""financial"": [""Receipt of a check for an amount significantly greater than the anticipated salary or initial payment."", ""Instructions to deposit the check and immediately wire or send a portion of the funds."", ""Requests to use payment methods like wire transfers (Western Union, MoneyGram) and Zelle, which are irreversible and favored by scammers.""], ""job_posting"": [""The initial job posting source (student email) is not necessarily a reliable or vetted source.""], ""hiring_process"": [""Rapid hiring process without any interviews or vetting."", ""Offer of employment contingent on depositing and forwarding funds.""], ""work_activity"": [""No actual work was performed.""]}, ""financial_risk"": {""level"": ""Critical"", ""potential_loss"": ""Total amount scammed is [AMOUNT] + [AMOUNT] + [AMOUNT]"", ""explanation"": ""The victim deposited a fraudulent check, believing the funds were legitimate, and then sent money to the scammer. They have lost all the funds sent and their bank has denied responsibility.""}, ""victim_profile"": {""vulnerability_factors"": [""Student email - likely indicating inexperience with employment processes."", ""Desire for quick income."", ""Trusting nature""], ""risk_level"": ""High""}, ""evidence_strength"": ""Strong"", ""recommendations"": {""immediate_actions"": [""Report the scam to the Federal Trade Commission (FTC) and the Internet Crime Complaint Center (IC3)."", ""Contact local law enforcement."", ""Gather all communication and documents related to the scam."", ""If the university email was used, inform the university authorities to prevent other students from falling victim.""], ""verification_steps"": [""Attempt to verify the identity of the \""employer\"" by searching for the company and contacting them directly through official channels (website, phone number) *not* those provided by the scammer."", ""Verify the check with the issuing bank, though this would have already happened (negatively)."", ""Report the bank account used to the bank to flag potential fraudulent activity.""], ""reporting"": [""Report the scam to the FTC at ReportFraud.ftc.gov."", ""File a complaint with the IC3 at ic3.gov."", ""Report the activity to your bank for assistance.""]}, ""confidence"": 95}",95
9709633,2025-12-03T15:41:34.957080,1352,"{""scam_probability"": 95, ""scam_type"": {""primary_category"": ""Fake Placement/Staffing Scams"", ""subcategory"": ""Check Cashing/Overpayment Scam""}, ""red_flags"": {""communication"": [""Extensive text interview (unprofessional)"", ""Communication exclusively through text and unknown methods (SMS)"", ""Hasty hiring process (fast turnaround)""], ""financial"": [""Being asked to deposit a check and forward funds to a third party (classic sign of a scam)"", ""Instructions to transfer money for computer supplies (suspicious)"", ""Check returned NSF (Non-Sufficient Funds)"", ""Loss of funds: {[AMOUNT]}""], ""job_posting"": [""Impersonation of a real talent acquisition firm (corporate identity theft)"", ""The role is not important to the scam, the focus is the check cashing.""], ""hiring_process"": [""Offer letter signed before any real work is done"", ""Request for personal information (SSN, bank account, driver's license) before any work is done and before a deposit for supplies."", ""Rapid hiring timeline""], ""work_activity"": [""Being asked to purchase supplies through an unfamiliar vendor with money from a check deposit (highly suspicious)""]}, ""financial_risk"": {""level"": ""Critical"", ""potential_loss"": ""{[AMOUNT]}"", ""explanation"": ""Victim lost {[AMOUNT]} due to depositing a fraudulent check and sending the money to a third party. The bank will not refund the money.""}, ""victim_profile"": {""vulnerability_factors"": [""Underemployed/Financial strain"", ""Desperation to find employment""], ""risk_level"": ""High""}, ""evidence_strength"": ""Strong"", ""recommendations"": {""immediate_actions"": [""Continue to document all communications and interactions with the scammers and the bank."", ""Gather all evidence (offer letter, communications, check image, bank statements) and file an official complaint with the FTC (Federal Trade Commission) if not already done. This helps track scam trends and potentially recover funds."", ""Consult with a legal professional. While recovering funds from a scam is difficult, an attorney can advise on potential legal options.""], ""verification_steps"": [""Verify the legitimacy of the company by independently contacting the real talent acquisition firm (XXXX)."", ""Check the background of any future employers using reputable services, and thoroughly research the company website and contact information."", ""Be wary of offers that seem too good to be true, especially those that involve upfront payments or unusual financial arrangements.""], ""reporting"": [""File a complaint with the Internet Crime Complaint Center (IC3), a partnership between the FBI and the National White Collar Crime Center."", ""Follow up on reports made to police, FBI, FTC, IRS, and social security.  Provide them with any additional evidence you find."", ""If personal information was compromised (SSN, Driver's License), consider placing an extended fraud alert or security freeze on your credit reports.""]}, ""confidence"": 98}",95
8714085,2025-12-03T15:41:35.212761,2987,"{""scam_probability"": 95, ""scam_type"": {""primary_category"": ""Financial Mark Scams"", ""subcategory"": ""Fake Check Scam""}, ""red_flags"": {""communication"": [""Unsolicited email offering a job."", ""Communication from an email address impersonating a legitimate institution (XXXX XXXX XXXX XXXX XXXX XXXX)."", ""Requests for funds transfer via Zelle or other means.""], ""financial"": [""Receipt of a check for an excessive amount, far beyond the initial assignment payment."", ""Request to transfer funds to another party."", ""The check later bounced, indicating it was fraudulent."", ""Victim is now liable for the transferred funds.""], ""job_posting"": [""The job was likely not legitimate.""], ""hiring_process"": [""The job was secured very quickly with minimal interview or vetting."", ""The work assignment was likely designed to gain the victim's trust.""], ""work_activity"": [""The initial assignment was probably designed to make the scam seem believable.""]}, ""financial_risk"": {""level"": ""Critical"", ""potential_loss"": ""{[AMOUNT]}"", ""explanation"": ""The victim is liable for the funds transferred, which were from a fraudulent check.""}, ""victim_profile"": {""vulnerability_factors"": [""Seeking a work-from-home opportunity."", ""Financial need (willing to take on extra work)."", ""Trusting nature.""], ""risk_level"": ""Medium""}, ""evidence_strength"": ""Strong"", ""recommendations"": {""immediate_actions"": [""Continue to work with the police and bank to try and recover funds."", ""Review bank statements closely for any other unauthorized transactions."", ""Monitor credit reports for any signs of identity theft.""], ""verification_steps"": [""Gather all communication from the 'employer'."", ""Provide all documentation to the authorities and bank."", ""Keep records of all communication with the bank, police, and other relevant parties.""], ""reporting"": [""Report the scam to the Federal Trade Commission (FTC)."", ""File a complaint with the Better Business Bureau (BBB)."", ""Continue working with the IC3 (Internet Crime Complaint Center).""]}, ""confidence"": 95}",95
1617882,2025-12-03T15:41:39.275426,2510,"{""scam_probability"": 95, ""scam_type"": {""primary_category"": ""Financial Mark Scams"", ""subcategory"": ""Payment Processing Scam (Check/Wire Transfer Fraud)""}, ""red_flags"": {""communication"": [""Unprofessional email communication (implied)"", ""Vague details about the company and its operations""], ""financial"": [""Being asked to purchase equipment and ship it out of the country using personal funds (credit card)."", ""Receiving a large sum of money to purchase equipment, which is then reversed."", ""Using a personal credit card for company expenses."", ""Funds deposited into account for purchase of equipment.""], ""job_posting"": [""Vague or non-existent job description.""], ""hiring_process"": [""Rapid hiring process."", ""Long training period before any official hiring decision."", ""Request to use personal credit card for company expenses.""], ""work_activity"": [""Tasks involve money transfers and purchasing items for the company.""]}, ""financial_risk"": {""level"": ""High"", ""potential_loss"": ""{[AMOUNT]}"", ""explanation"": ""The victim was asked to use their own credit card to purchase equipment and ship it internationally, with the promise of reimbursement. The funds deposited in their account were fraudulent, and the reversal left them liable for the charges.""}, ""victim_profile"": {""vulnerability_factors"": [""Unemployment"", ""Desire for employment""], ""risk_level"": ""Medium""}, ""evidence_strength"": ""Strong"", ""recommendations"": {""immediate_actions"": [""Contact credit card company again to dispute the charge."", ""File a police report and report the scam to the Federal Trade Commission (FTC) and the Internet Crime Complaint Center (IC3)."", ""Monitor credit reports for any fraudulent activity."", ""Consider freezing credit to prevent identity theft."", ""Document all communication and transactions related to the scam.""], ""verification_steps"": [""Attempt to independently verify the existence and legitimacy of the company through multiple sources."", ""Search online for reviews or complaints about the company."", ""Be wary of any job that requires you to handle money, especially early in the process.""], ""reporting"": [""Report the scam to the FTC (Federal Trade Commission)"", ""File a complaint with the IC3 (Internet Crime Complaint Center)""]}, ""confidence"": 95}",95
5788206,2025-12-03T15:41:39.563856,1066,"{""scam_probability"": 95, ""scam_type"": {""primary_category"": ""Fake Placement/Staffing Scams"", ""subcategory"": ""Check Cashing Scam/Overpayment Scam""}, ""red_flags"": {""communication"": [""Unsolicited contact from a recruiter found the resume on Indeed."", ""Instructions to communicate with multiple individuals."", ""Inconsistent or mismatched names in communication.""], ""financial"": [""Received a check for a large amount seemingly without initial work."", ""Instructions to send money to other individuals."", ""The check bounced and the funds were fraudulent."", ""The check amount was supposedly to cover the cost of the work equipment.""], ""job_posting"": [""The company name is not known. The company name, if real, likely has nothing to do with this activity."", ""Job role is not specified.""], ""hiring_process"": [""Rapid hiring process after an interview with no clear job description."", ""The explanation for the check is not normal hiring practice.""], ""work_activity"": [""The job involved sending funds to other people."", ""Equipment was supposedly purchased upfront via funds from the job.""]}, ""financial_risk"": {""level"": ""Critical"", ""potential_loss"": ""The amount sent to the other individuals, plus any fees associated with the bounced check and the negative balance in the bank account."", ""explanation"": ""The victim lost the funds they sent to other individuals and is now responsible for a negative bank account balance due to a fraudulent check.""}, ""victim_profile"": {""vulnerability_factors"": [""Seeking employment."", ""Trusting in the appearance of a legitimate opportunity."", ""Lack of knowledge about common scams.""], ""risk_level"": ""Medium""}, ""evidence_strength"": ""Strong"", ""recommendations"": {""immediate_actions"": [""File a police report."", ""Continue to document all communication and financial transactions."", ""Consult with a legal professional."", ""Close or dispute the bank account if possible.""], ""verification_steps"": [""Attempt to independently verify the legitimacy of the company if possible (though this is less critical now)."", ""Keep records of all communication and transactions.""], ""reporting"": [""Report the scam to the Federal Trade Commission (FTC)."", ""Report to the Internet Crime Complaint Center (IC3) - FBI."", ""Report to the Consumer Financial Protection Bureau (CFPB).""]}, ""confidence"": 95}",95
2693172,2025-12-03T15:41:44.636899,2971,"{""scam_probability"": 95, ""scam_type"": {""primary_category"": ""Financial Mark Scams"", ""subcategory"": ""Fake Check Scam""}, ""red_flags"": {""communication"": [""Unsolicited job offer via email."", ""Vague description of job duties, primarily focused on handling finances."", ""Use of informal and poor grammar."", ""Pressure to act quickly."", ""Lack of detailed information about the 'artist' and their work."", ""The scammer becomes defensive when questioned.""], ""financial"": [""Sending a check before the victim has started any work."", ""The check amount is significantly higher than the initial expected payment."", ""Instructions to use the funds to pay a 'supplier'."", ""Request to transfer money to a third party."", ""The check bounced after the victim followed instructions.""], ""job_posting"": [""Applying to various positions and then receiving an offer for a completely different role""], ""hiring_process"": [""No formal interview process."", ""Job offer is made quickly and without thorough vetting.""], ""work_activity"": [""The primary task is to handle financial transactions."", ""The victim is asked to make purchases on behalf of someone else.""]}, ""financial_risk"": {""level"": ""High"", ""potential_loss"": ""The total amount of the check, as the victim deposited and was then likely responsible for the loss."", ""explanation"": ""The victim deposited a fraudulent check, and unknowingly became an accomplice to the scam as she followed instructions.""}, ""victim_profile"": {""vulnerability_factors"": [""Job searching and actively looking for work."", ""Desire to start earning income quickly."", ""Trusting nature"", ""Naive to the tactics of scammers.""], ""risk_level"": ""Medium""}, ""evidence_strength"": ""Strong"", ""recommendations"": {""immediate_actions"": [""Gather all evidence: emails, texts, check image, bank statements."", ""Contact the local police and file a report regarding the financial fraud."", ""Report the fraud to the Federal Trade Commission (FTC) at ReportFraud.ftc.gov."", ""Contact the Internet Crime Complaint Center (IC3) - a partnership between the FBI and the National White Collar Crime Center - and file a complaint."", ""Seek legal advice from a lawyer specializing in financial fraud to understand rights and options.""], ""verification_steps"": [""Provide all documentation to the authorities."", ""Work with law enforcement to identify the scammer, the check's origin, and the intended destination of the money."", ""Contact credit reporting agencies to explain the situation to prevent further damage to credit.""], ""reporting"": [""Report the scam to the Bank of America if not yet reported."", ""Report the fraudulent check to the issuing bank (if known)."", ""File reports with law enforcement and government agencies (FTC, IC3).""]}, ""confidence"": 98}",95
5833930,2025-12-03T15:41:44.750117,2379,"{""scam_probability"": 95, ""red_flags"": [], ""financial_risk"": ""{"", ""scam_type"": ""{"", ""victim_profile"": ""{"", ""recommendations"": [], ""confidence"": 98}",95
