complaint_id,timestamp,text_length,gemini_analysis,risk_score
17196888,2025-12-03T20:12:17.163252,207,"{""scam_probability"": 95, ""scam_type"": {""primary_category"": ""Financial Mark Scams"", ""subcategory"": ""Romance Scam / Investment Scam Hybrid""}, ""red_flags"": {""communication"": [""Unsolicited contact (implied by 'stolen from me')"", ""Communication involving bots and 'not real people' suggests deceptive communication tactics.""], ""financial"": [""Direct theft of money ('stealing money from all the customers')"", ""The mention of an app where money is stolen implies financial transactions were involved.""], ""job_posting"": [], ""hiring_process"": [], ""work_activity"": [""Receiving and potentially processing funds through the app (implied by money being stolen)"", ""The app appears to be a platform for fraudulent financial activities.""]}, ""financial_risk"": {""level"": ""Critical"", ""potential_loss"": ""Unknown, but significant given the context of money theft"", ""explanation"": ""The complaint explicitly states money was stolen, indicating a direct financial loss through fraudulent means.""}, ""victim_profile"": {""vulnerability_factors"": [""Seeking remote/work-from-home opportunities (implied by using an app for financial transactions which could be marketed as a remote job)"", ""Potential for emotional vulnerability (as it's identified as a romance scam).""], ""risk_level"": ""High""}, ""evidence_strength"": ""Strong"", ""recommendations"": {""immediate_actions"": [""Immediately stop all communication with individuals/entities associated with the app."", ""If any financial accounts are linked to the app, contact the financial institutions to report fraud and potentially freeze or close accounts.""], ""verification_steps"": [""Gather all transaction records and communications related to the app."", ""Document the timeline of interactions and financial exchanges.""], ""reporting"": [""Report the scam to relevant consumer protection agencies (e.g., FTC in the US, Action Fraud in the UK, or equivalent in the victim's country)."", ""Report the app to the app store where it was downloaded."", ""If the scam involved romance elements, consider reporting to law enforcement.""]}, ""confidence"": 98}",95
17046297,2025-12-03T20:12:20.952759,703,"{""scam_probability"": 95, ""scam_type"": {""primary_category"": ""Financial Mark Scams"", ""subcategory"": ""Fake Transaction/Money Mule Scheme""}, ""red_flags"": {""communication"": [""Unprofessional language/poor grammar ('lead to beleive', 'washed their hands of it all', 'nobody seems to concerned', 'there is a XXXX XXXX why can\\'t I have access')"", ""Lack of responsiveness and stonewalling from the bank"", ""Being hung up on and transferred to multiple departments without resolution""], ""financial"": [""Direct payment set up through a business account without explicit authorization""], ""job_posting"": [], ""hiring_process"": [], ""work_activity"": [""Receiving and potentially processing funds that are not legitimate income"", ""The scenario suggests the business account was used as a conduit for illicit funds, possibly through a fake invoice or service.""]}, ""financial_risk"": {""level"": ""Critical"", ""potential_loss"": ""Unknown"", ""explanation"": """"}, ""victim_profile"": {""vulnerability_factors"": [], ""risk_level"": ""High""}, ""evidence_strength"": ""Strong"", ""recommendations"": {""immediate_actions"": [], ""verification_steps"": [], ""reporting"": []}, ""confidence"": 90}",95
17089556,2025-12-03T20:13:01.294931,221,"{""scam_probability"": 95, ""scam_type"": {""primary_category"": ""Financial Mark Scams"", ""subcategory"": ""Online Marketplace Scam""}, ""red_flags"": {""communication"": [""Seller was unable to provide shipping number upon request.""], ""financial"": [""Payment was made for a product, but the product was never received.""], ""job_posting"": [], ""hiring_process"": [], ""work_activity"": []}, ""financial_risk"": {""level"": ""Medium"", ""potential_loss"": ""<amount paid for the item>"", ""explanation"": ""The victim paid for an item but did not receive it, resulting in a direct financial loss of the purchase price.""}, ""victim_profile"": {""vulnerability_factors"": [""Purchasing from online marketplaces where seller verification can be difficult.""], ""risk_level"": ""Medium""}, ""evidence_strength"": ""Strong"", ""recommendations"": {""immediate_actions"": [""Initiate a dispute through PayPal's Resolution Center for 'Item Not Received'.""], ""verification_steps"": [""Gather all communication records with the seller, including transaction details and any messages exchanged.""], ""reporting"": [""Report the seller to XXXX market's customer service."", ""Consider reporting the incident to relevant consumer protection agencies if PayPal's dispute process is unsuccessful.""]}, ""confidence"": 98}",95
16972121,2025-12-03T20:13:01.796033,1603,"{""scam_probability"": 10, ""scam_type"": {""primary_category"": ""Financial Mark Scams"", ""subcategory"": ""Impersonation Scam""}, ""red_flags"": {""communication"": [""Victim was under pressure and believed they were under investigation (implies aggressive or threatening communication from scammers).""], ""financial"": [""Coerced into wiring money to unknown entities."", ""Bank failed to intervene despite employees observing visible distress and inconsistencies in wire instructions.""], ""job_posting"": [], ""hiring_process"": [], ""work_activity"": []}, ""financial_risk"": {""level"": ""Critical"", ""potential_loss"": ""{[AMOUNT]}"", ""explanation"": ""Victim lost a significant amount of money due to a wire transfer scam and then had their remaining balance frozen and seized by the bank.""}, ""victim_profile"": {""vulnerability_factors"": [""Victim is autistic and experienced anxiety and confusion during the incident."", ""Victim was susceptible to pressure and threats from the scammers.""], ""risk_level"": ""High""}, ""evidence_strength"": ""Strong"", ""recommendations"": {""immediate_actions"": [""Continue to pursue action through the CFPB."", ""Gather all documentation related to the wire transfers and bank interactions.""], ""verification_steps"": [""Request a detailed explanation from Bank of America regarding the freezing and seizure of funds."", ""Obtain copies of any internal bank communications or notes related to the wire transfer and the subsequent account freeze.""], ""reporting"": [""Report the fraud to the relevant law enforcement agencies in the victim's jurisdiction."", ""Report the bank's handling of the situation to any relevant banking regulatory bodies.""]}, ""confidence"": 95}",10
17280602,2025-12-03T20:13:04.229679,1028,"{""scam_probability"": 95, ""scam_type"": {""primary_category"": ""Financial Mark Scams"", ""subcategory"": ""Wire Fraud""}, ""red_flags"": {""communication"": [""Smug and indifferent response from Citibank's fraud department, unwilling to provide a reference number or follow-up contact."", ""Lack of transparency or accountability from the bank regarding the investigation.""], ""financial"": [""Funds sent via wire transfer to an account named XXXX XXXX XXXX at Citibank."", ""Loss of a significant amount of money ({[AMOUNT]}).""], ""job_posting"": [], ""hiring_process"": [], ""work_activity"": []}, ""financial_risk"": {""level"": ""Critical"", ""potential_loss"": ""{[AMOUNT]}"", ""explanation"": ""The victim has already lost a substantial sum of money through a wire transfer, indicating a complete loss of the funds transferred.""}, ""victim_profile"": {""vulnerability_factors"": [""Employment desperation (implied by seeking job-related scams)."", ""Seeking remote/work-from-home opportunities (implied by the nature of the scam, often presented as remote jobs).""], ""risk_level"": ""High""}, ""evidence_strength"": ""Strong"", ""recommendations"": {""immediate_actions"": [""Continue cooperating with the FBI investigation."", ""Consult with the attorney regarding subpoenaing Citibank's records.""], ""verification_steps"": [""Gather all documentation related to the wire transfer, including any forms or communication with the supposed representative."", ""Document all communication attempts with Citibank and their responses (or lack thereof).""], ""reporting"": [""Ensure a report has been filed with the FBI (already done)."", ""Consider reporting the incident to consumer protection agencies in the relevant jurisdiction.""]}, ""confidence"": 98}",95
17163492,2025-12-03T20:13:05.514439,2442,"{""scam_probability"": 10, ""scam_type"": {""primary_category"": ""Financial Mark Scams"", ""subcategory"": ""Phishing/Online Marketplace Fraud""}, ""red_flags"": {""communication"": [""The victim is actively trying to communicate with Wells Fargo to resolve the issue, but Wells Fargo is not responding. This points to a lack of communication from the institution that should be assisting.""], ""financial"": [""The core of the complaint is about a fraudulent wire transfer and the subsequent loss of funds."", ""The recipient account was fraudulent and funds were rapidly withdrawn/transferred, indicating a scam operation."", ""The victim is seeking restitution, highlighting a significant financial loss.""], ""job_posting"": [], ""hiring_process"": [], ""work_activity"": [""The victim was instructed to wire transfer funds to a fraudulent account, which is a common tactic in financial scams.""]}, ""financial_risk"": {""level"": ""Critical"", ""potential_loss"": ""{[AMOUNT]}"", ""explanation"": ""The victim has already lost a significant sum of money due to a fraudulent transaction.""}, ""victim_profile"": {""vulnerability_factors"": [""Seeking remote/work-from-home opportunities (implied by looking to purchase a vehicle, potentially for a new job or other needs)"", ""Employment desperation (possible, as purchasing a vehicle can be linked to employment needs)""], ""risk_level"": ""Medium""}, ""evidence_strength"": ""Strong"", ""recommendations"": {""immediate_actions"": [""Continue to pursue recovery of funds through legal channels."", ""File a police report if one has not already been filed."", ""Escalate the complaint with Wells Fargo's executive relations or ombudsman office.""], ""verification_steps"": [""Gather all documentation related to the transaction (wire transfer confirmation, purchase agreement, online listing, communication logs with the seller).""], ""reporting"": [""Report the fraud to the FBI's Internet Crime Complaint Center (IC3)."", ""Report the incident to the Consumer Financial Protection Bureau (CFPB).""]}, ""confidence"": 95}",10
