complaint_id,timestamp,text_length,gemini_analysis,risk_score
11310670,2025-12-03T16:57:53.090869,1541,"{""scam_probability"": 95, ""scam_type"": {""primary_category"": ""Financial Mark Scams"", ""subcategory"": ""Advance Fee Scam/Fake Employment""}, ""red_flags"": {""communication"": [""Communication from an entity claiming to be a legitimate employer (XXXX) but later revealed to be impersonated.""], ""financial"": [""Victim was convinced to send money under false pretenses."", ""The transactions were understood to be part of the scam after the fact."", ""Loss of a significant amount of money through these transactions.""], ""job_posting"": [""Vague job description or responsibilities ('completing sets and reviewing albums and singles')."", ""The job was presented as legitimate remote work, which can be a common lure for scams.""], ""hiring_process"": [""The job offer and tasks were performed without the victim realizing it was a scam until after completion."", ""The communication with alleged representatives of XXXX was part of the fraudulent process.""], ""work_activity"": [""Instructed to move money between accounts (implied by 'funds were transferred through transactions that I now understand were part of the scam')."", ""The nature of the tasks ('completing sets and reviewing albums and singles') could be a cover for money laundering or other illicit financial activities, making it a money mule-like scenario.""]}, ""financial_risk"": {""level"": ""Critical"", ""potential_loss"": ""{[AMOUNT]}"", ""explanation"": ""The victim explicitly states they were 'scammed out of a significant amount of moneyapproximately {[AMOUNT]}' through fraudulent transactions.""}, ""victim_profile"": {""vulnerability_factors"": [""Seeking remote/work-from-home opportunities."", ""Financial hardship (implied by 'significant financial hardship').""], ""risk_level"": ""High""}, ""evidence_strength"": ""Strong"", ""recommendations"": {""immediate_actions"": [""Cease all communication with the identified scammers."", ""Preserve all existing evidence meticulously.""], ""verification_steps"": [""Request a detailed explanation from Santander regarding the 'inconsistencies' that led to the claim denial."", ""Gather all documentation proving the fraudulent nature of the transactions and communications."", ""Consult with a legal professional specializing in fraud recovery for advice on pursuing further action against the bank's decision or the scammers."", ""Provide all collected evidence to law enforcement for their investigation.""], ""reporting"": [""Continue to cooperate fully with law enforcement investigations."", ""Consider reporting to consumer protection agencies (e.g., FTC in the US) if applicable in the victim's jurisdiction.""]}, ""confidence"": 98}",95
11258229,2025-12-03T16:57:53.519044,1219,"{""scam_probability"": 95, ""scam_type"": {""primary_category"": ""Financial Mark Scams"", ""subcategory"": ""Fake Check Scam / Money Mule Scam""}, ""red_flags"": {""communication"": [""Pressure tactics to deposit check and transfer funds immediately.""], ""financial"": [""Requested a check deposit and then instructed to transfer funds to a fake vendor."", ""The victim sent money to a fake vendor for remote equipment.""], ""job_posting"": [""The initial job offer seemed legitimate, but the subsequent actions revealed the scam.""], ""hiring_process"": [""The scammer provided documentation that mimicked a real company, creating a false sense of legitimacy."", ""The scammer was pushy for immediate action (depositing check, transferring funds).""], ""work_activity"": [""Instructed to transfer money to a fake vendor."", ""The nature of the 'work environment' justified the immediate deposit and transfer, a common tactic in money mule scams.""]}, ""financial_risk"": {""level"": ""Critical"", ""potential_loss"": ""{[AMOUNT]}"", ""explanation"": ""The victim lost a significant amount of money by transferring it to a fake vendor, likely as part of a fake check scam where the deposited check was fraudulent.""}, ""victim_profile"": {""vulnerability_factors"": [""Seeking remote/work-from-home opportunities"", ""Employment desperation (implied by seeking work in 'this economy')"", ""Trust in official-looking documentation""], ""risk_level"": ""High""}, ""evidence_strength"": ""Strong"", ""recommendations"": {""immediate_actions"": [""Continue cooperating with law enforcement agencies (FBI IC3, FTC, DFPI)."", ""Gather and securely store all communication records, documentation, voice recordings, and transaction details.""], ""verification_steps"": [""Do not engage with the scammer further."", ""Be extremely cautious of any further contact from the scammer or related entities.""], ""reporting"": [""Ensure all reports to the FBI IC3, FTC, and DFPI are complete and include all gathered evidence."", ""If the scammer used a platform other than PayPal (e.g., Zelle, Venmo) for the transfer, report it to those platforms as well.""]}, ""confidence"": 98}",95
11629506,2025-12-03T16:57:54.357222,1669,"{""scam_probability"": 95, ""scam_type"": {""primary_category"": ""Financial Mark Scams"", ""subcategory"": ""Fake Check / Money Mule Scam""}, ""red_flags"": {""communication"": [""Unsolicited contact via email (initially appeared in college email, though the victim replied)"", ""Communication from personal email (implied by the nature of the follow-up messages and lack of formal company domain)"", ""Pressure tactics ('couldn't wait since it would delay their schedule time')"", ""Lack of professional communication (texting for job-related matters, no response when issues arose)""], ""financial"": [""Requests payment upfront for 'materials' (victim asked to deposit checks and buy items)"", ""Asks for bank account, credit card, or SSN before job offer (implied by the check deposit process and subsequent request for personal funds)"", ""Requests financial information early in process (before conditional offer - checks and personal savings requested)"", ""Use of fake checks to launder money"", ""Instructed to send money from personal savings to the scammer""], ""job_posting"": [""Extremely high pay for minimal experience/effort (implied by the internship offer and the ease with which tasks were supposedly completed)"", ""Vague job description or responsibilities (no clear tasks mentioned beyond obtaining materials)"", ""Promises of easy money for student bills""], ""hiring_process"": [""Job offer without interview or after brief text exchange (no formal interview, only email and text communication)"", ""No formal application or background check (implied by the quick onboarding and lack of verification)"", ""Immediate hiring/start date (implied by the urgency to deposit checks and acquire materials)""], ""work_activity"": [""Asked to receive and reship packages to unknown addresses (implied by the request to deposit checks and buy materials, which could be for reshipment)"", ""Instructed to move money between accounts (depositing fake checks and then sending personal funds)"", ""Required to recruit others as primary job function (not explicitly stated, but common in money mule scams)""]}, ""financial_risk"": {""level"": ""Critical"", ""potential_loss"": ""All savings and money from fake checks (significant, likely thousands of dollars)"", ""explanation"": ""The victim lost all of their savings and the funds from the fake checks, resulting in a negative bank balance. The exact amount is not specified but is described as 'everything'.""}, ""victim_profile"": {""vulnerability_factors"": [""Employment desperation (recently unemployed, financial hardship) - seeking to pay off student bills"", ""Seeking remote/work-from-home opportunities (implied by the initial email and the nature of the scam)"", ""Limited job search experience (implied by a college student relying on a college email for internship offers and not immediately recognizing red flags)""], ""risk_level"": ""High""}, ""evidence_strength"": ""Strong"", ""recommendations"": {""immediate_actions"": [""Contact banks to file fraud reports for all accounts involved."", ""Change all passwords for online banking and email accounts."", ""Monitor credit reports for any fraudulent activity.""], ""verification_steps"": [""Preserve all communication logs (emails, texts)."", ""Gather details of the fake checks (bank name, routing, account numbers if available)."", ""Identify any specific names or contact information provided by the scammers.""], ""reporting"": [""File a report with the Federal Trade Commission (FTC) at ReportFraud.ftc.gov."", ""File a report with the FBI's Internet Crime Complaint Center (IC3)."", ""Continue to cooperate with local law enforcement regarding the incident.""]}, ""confidence"": 98}",95
11582419,2025-12-03T16:57:55.832654,636,"{""scam_probability"": 95, ""scam_type"": {""primary_category"": ""Financial Mark Scams"", ""subcategory"": ""Fake Check Scam""}, ""red_flags"": {""communication"": [], ""financial"": [""Requests payment upfront for any reason (equipment, training, background check)""], ""job_posting"": [""Extremely high pay for minimal experience/effort"", ""Vague job description or responsibilities""], ""hiring_process"": [""Job offer without interview or after brief text exchange"", ""No formal application or background check""], ""work_activity"": [""Asked to receive and reship packages to unknown addresses"", ""Instructed to move money between accounts""]}, ""financial_risk"": {""level"": ""Critical"", ""potential_loss"": ""{[AMOUNT]}"", ""explanation"": ""The victim lost over {[AMOUNT]} due to a fake check scam where they were instructed to purchase equipment, likely involving fraudulent transactions.""}, ""victim_profile"": {""vulnerability_factors"": [""Employment desperation (recently unemployed, financial hardship)"", ""Limited job search experience"", ""Seeking remote/work-from-home opportunities""], ""risk_level"": ""High""}, ""evidence_strength"": ""Strong"", ""recommendations"": {""immediate_actions"": [""Report the scam to the relevant authorities (e.g., FTC, local law enforcement)."", ""Contact financial institutions involved to dispute transactions and explore recovery options."", ""Monitor credit reports for any signs of identity theft."", ""Cease all communication with the scammers.""], ""verification_steps"": [""Verify any job offer through official company channels and independent searches."", ""Never send money or provide personal financial information before a legitimate job offer and onboarding process."", ""Be wary of unsolicited job offers, especially those promising high pay for simple tasks."", ""Research companies thoroughly before engaging.""], ""reporting"": [""Federal Trade Commission (FTC): ReportFraud.ftc.gov"", ""FBI Internet Crime Complaint Center (IC3): ic3.gov"", ""Local Law Enforcement Agency""]}, ""confidence"": 98}",95
11338911,2025-12-03T16:57:56.896547,1428,"{""scam_probability"": 98, ""scam_type"": {""primary_category"": ""Financial Mark Scams"", ""subcategory"": ""Fake Check / Advance Fee Scam""}, ""red_flags"": {""communication"": [""Initial contact via email to a personal account."", ""Transition to text-based communication for job progression."", ""Lack of response from the scammer once the victim realized the scam.""], ""financial"": [""Requests for payment for materials for an internship (likely fake training or equipment)."", ""Sending digital checks for the victim to deposit and then pay out of pocket."", ""Issuing 'reimbursement' checks that are also fake, perpetuating the cycle."", ""The core of the scam involves fake checks designed to defraud the recipient.""], ""job_posting"": [""The job was advertised as an 'internship', which can sometimes be used to exploit individuals seeking experience or resume building opportunities.""], ""hiring_process"": [""Job offer (implied) without a formal interview process, based on a reply to an email and discussion of achievements."", ""The process moved rapidly from initial contact to payment requests."", ""No mention of a formal application or background check beyond initial email exchange.""], ""work_activity"": [""The victim was instructed to deposit checks and then use their own funds to pay for 'materials' or 'reimbursements', a common money mule tactic indirectly."", ""The core activity involved processing fake financial instruments (checks).""]}, ""financial_risk"": {""level"": ""Critical"", ""potential_loss"": ""All savings"", ""explanation"": ""The victim lost all of their savings due to the fake check scam, being tricked into sending their own money to cover expenses that were supposed to be covered by the fake reimbursement.""}, ""victim_profile"": {""vulnerability_factors"": [""Seeking remote/work-from-home opportunities (implied by the nature of the initial email contact and the lack of in-person interaction)."", ""Seeking internship roles, often implying a desire for experience and potentially less financial scrutiny."", ""Employment desperation (implied by actively replying to unsolicited emails and engaging in the process).""], ""risk_level"": ""High""}, ""evidence_strength"": ""Strong"", ""recommendations"": {""immediate_actions"": [""Contact the bank to monitor all accounts for any further suspicious activity."", ""Change passwords for all online accounts, especially email and banking.""], ""verification_steps"": [""Gather all communication records (emails, texts) with the scammer."", ""Collect any digital checks or transaction records provided by the scammer.""], ""reporting"": [""File a detailed complaint with the Federal Trade Commission (FTC)."", ""File a complaint with the Internet Crime Complaint Center (IC3)."", ""Provide all gathered evidence to law enforcement for a more thorough investigation.""]}, ""confidence"": 95}",98
11913356,2025-12-03T16:57:59.215927,3015,"{""scam_probability"": 95, ""scam_type"": {""primary_category"": ""Financial Mark Scams"", ""subcategory"": ""Fake Check/Payment Scam""}, ""red_flags"": {""communication"": [""Communication likely initiated by scammer as the complaint states 'approached for my XXXX XXXX XXXX from an individual'"", ""Use of text and email for communication, which can be less formal and harder to trace than official channels. Specific mention of feedback through text and email."", ""Scammer 'went dark' and lost contact when confronted about the invalid check, a common tactic to avoid accountability.""], ""financial"": [""Scammer sent a check in advance for services (fake check scam)."", ""The check was for a large amount ({[AMOUNT]}) and victim was instructed to cash it digitally as soon as possible."", ""The scammer requested money back digitally shortly after the fake check was cashed, before it bounced."", ""The initial check was discovered to be fake and reversed."", ""Victim was asked to send money back in 'waves', indicating a structured attempt to extract funds before the fraud was fully realized."", ""Scammer insisted on paying the full amount upfront via certified cashier's check, rather than a deposit, to facilitate the fake check scheme.""], ""job_posting"": [""The initial description of the role seems vague ('XXXX XXXX XXXX XXXX XXXX XXXX')."", ""The offer of a large budget ({[AMOUNT]}) for illustration work without clear scope details can be a lure."", ""The project cancellation in phases and requests for money back points to an unrealistic initial promise of work.""], ""hiring_process"": [""Job offer appears to have been extended based on an approach, not a formal application and interview process."", ""Scammer requested sensitive personal information (name, address, bank, phone number) early in the process for 'check distribution'."", ""The rapid pace of events after cashing the check (project cancellation, request for funds back) suggests an immediate and pressured timeline.""], ""work_activity"": [""Instructed to receive a check and cash it, which is a precursor to money mule activities. The intent was to use the victim's account to process fake funds."", ""Asked to send money back digitally, a common step in money mule scams where victims unknowingly send illicit funds.""]}, ""financial_risk"": {""level"": ""Critical"", ""potential_loss"": ""{[AMOUNT]} (plus potentially more if they had continued to send money)"", ""explanation"": ""The victim lost the amount they sent back digitally ({[AMOUNT]}) and the original check bounced, meaning they likely did not receive any legitimate funds for their work. They may also be liable for any overdraft fees or penalties from their bank. The scammer attempted to extract a significant amount of money.""}, ""victim_profile"": {""vulnerability_factors"": [""Seeking remote/work-from-home opportunities (implied by the nature of the scam involving digital transactions)."", ""Likely reliant on the income from the job offer, especially if facing financial hardship or employment desperation."", ""May have limited experience with sophisticated scams, leading them to trust the presented legitimacy of a 'school' and a cashier's check.""], ""risk_level"": ""High""}, ""evidence_strength"": ""Strong"", ""recommendations"": {""immediate_actions"": [""Cease all communication with the scammer immediately."", ""Contact bank again and formally dispute the transaction, providing all documentation and explaining the bank's previous error in not reviewing evidence."", ""Monitor bank accounts for any further fraudulent activity and consider placing fraud alerts on credit reports.""], ""verification_steps"": [""Always verify the legitimacy of any communication or job offer by independently searching for the company's official website and contact information, and calling them directly."", ""Never accept or cash checks for more than the agreed-upon service amount, and be wary of any instructions to send money back."", ""Understand that legitimate employers will not ask for personal financial information upfront or request payment for equipment or training before a formal offer is made and background checks are completed through official channels.""], ""reporting"": [""Report the scam to the Federal Trade Commission (FTC) at ReportFraud.ftc.gov."", ""Report the scam to the FBI's Internet Crime Complaint Center (IC3) at ic3.gov."", ""Report the scam to the local police department."", ""If the scam involved a specific company name (even if fake), report it to the relevant business registration authority in the state where the company claims to be located.""]}, ""confidence"": 98}",95
