complaint_id,timestamp,text_length,gemini_analysis,risk_score
17186864,2025-12-03T20:56:26.542706,1343,"{""scam_probability"": 95, ""is_job_related"": false, ""category"": ""scam_other"", ""scam_type"": {""primary_category"": ""service_scam"", ""subcategory"": ""fraudulent_inducement""}, ""red_flags"": {""communication"": [""stalled for weeks with various excuses"", ""stopped responding all together"", ""denied requests to speak to the actual owner""], ""financial"": [""asked to provide {[AMOUNT]} in advance for an {[AMOUNT]} contract"", ""made a series of XXXX transfers"", ""banks enabling continuing fraud by allowing services to be used""], ""job_posting"": [], ""hiring_process"": [], ""work_activity"": []}, ""financial_risk"": {""level"": ""High"", ""potential_loss"": ""N/A"", ""explanation"": ""The consumer paid a significant advance payment for home repair services, which were not rendered. The scammer then became unresponsive, and the banks involved have denied claims, indicating a loss of the advanced funds.""}, ""confidence"": 98}",95
16108072,2025-12-03T20:56:26.677521,370,"{""scam_probability"": 95, ""is_job_related"": false, ""category"": ""scam_other"", ""scam_type"": {""primary_category"": ""Financial Mark Scams"", ""subcategory"": ""Wire Fraud""}, ""red_flags"": {""communication"": [""Instructions re-routed to a fraudulent account due to a hacked internal email system.""], ""financial"": [""Instructions to make a wire transfer for a new car."", ""Beneficiary account name was correct, but the bank had changed.""], ""job_posting"": [], ""hiring_process"": [], ""work_activity"": []}, ""financial_risk"": {""level"": ""High"", ""potential_loss"": ""Amount of wire transfer"", ""explanation"": ""The complaint describes a wire transfer that was re-routed to a fraudulent account due to a hacked email system, indicating a likely financial loss related to the purchase of a car.""}, ""confidence"": 98}",95
15792287,2025-12-03T20:56:27.818340,664,"{""scam_probability"": 95, ""is_job_related"": false, ""category"": ""scam_other"", ""scam_type"": {""primary_category"": ""Service Scams"", ""subcategory"": ""Pet Scams""}, ""red_flags"": {""communication"": [""Inconsistent pickup location (police station)""], ""financial"": [""Demanding payment for vaccinations/prep before receiving item"", ""Denial of fraud claim by financial institutions (Wells Fargo, Apple)"", ""Use of multiple financial institutions to process payments""], ""job_posting"": [], ""hiring_process"": [], ""work_activity"": []}, ""financial_risk"": {""level"": ""Medium"", ""potential_loss"": ""N/A"", ""explanation"": ""The complaint mentions amounts, indicating a financial loss occurred, though the specific amount is redacted. The risk is medium as it involves direct payment for a non-existent service/item.""}, ""confidence"": 98}",95
17187709,2025-12-03T20:56:28.638566,535,"{""scam_probability"": 20, ""is_job_related"": false, ""category"": ""not_scam_irrelevant"", ""scam_type"": {""primary_category"": ""N/A"", ""subcategory"": ""N/A""}, ""red_flags"": {""communication"": [], ""financial"": [], ""job_posting"": [], ""hiring_process"": [], ""work_activity"": []}, ""financial_risk"": {""level"": ""N/A"", ""potential_loss"": ""N/A"", ""explanation"": ""N/A""}, ""confidence"": 95}",20
17224078,2025-12-03T20:56:29.150726,3012,"{""scam_probability"": 80, ""is_job_related"": false, ""category"": ""scam_other"", ""scam_type"": {""primary_category"": ""service scams"", ""subcategory"": ""banking/financial fraud""}, ""red_flags"": {""communication"": [""Contacted by what appeared to be the bank's fraud department regarding suspicious activity."", ""Communication mirrored legitimate messages.""], ""financial"": [""Scammed into depositing a cashier's check for {[AMOUNT]} to a fraudulent account."", ""Realized it was a scam merely XXXX hours after the fraudulent transaction was made."", ""Informed the bank that a {[AMOUNT]} cashiers check had been deposited into a fraudulent account."", ""Representative confirmed the receiving account was also with Wells Fargo and stated the transaction was still pending."", ""Advised that there was nothing they could do at that time but would 'flag' the check as fraudulent."", ""Advised to call Loss Prevention or visit a local bank to stop the payment."", ""Funds unfortunately processed."", ""Banker could see that {[AMOUNT]} of funds were still remaining in the suspect's account."", ""Unable to retrieve funds because the transfer was authorized."", ""Banker stated these types of scams are happening more and it's a 'legal loophole'."", ""Advised to take the loss."", ""Bank had to close compromised accounts."", ""Agent and supervisor confirmed the case was closed and no investigation was conducted because payment was authorized."", ""Dismissive response and lack of urgency from the bank."", ""Bank failed to provide a clear written explanation or meaningful resolution.""], ""job_posting"": [], ""hiring_process"": [], ""work_activity"": []}, ""financial_risk"": {""level"": ""High"", ""potential_loss"": ""{[AMOUNT]}"", ""explanation"": ""The consumer was defrauded into depositing a cashier's check into a fraudulent account, leading to a significant financial loss. The bank's response and alleged 'legal loophole' further exacerbate the financial risk and lack of recourse.""}, ""confidence"": 95}",80
17043107,2025-12-03T20:56:30.071331,1334,"{""scam_probability"": 95, ""is_job_related"": false, ""category"": ""scam_other"", ""scam_type"": {""primary_category"": ""financial"", ""subcategory"": ""wire_fraud""}, ""red_flags"": {""communication"": [""Caller impersonated a trusted institution (USAA)"", ""Caller used a spoofed phone number""], ""financial"": [""Scammers instructed victim to initiate transfers to 'dispute' fraudulent transactions"", ""Victim lost funds due to following scammer's instructions""], ""job_posting"": [], ""hiring_process"": [], ""work_activity"": []}, ""financial_risk"": {""level"": ""High"", ""potential_loss"": ""{[AMOUNT]}"", ""explanation"": ""The victim was tricked into making a transfer to an external account under the guise of disputing fraudulent charges, leading to the loss of funds.""}, ""confidence"": 98}",95
17055813,2025-12-03T20:56:32.121143,923,"{""scam_probability"": 90, ""is_job_related"": false, ""category"": ""scam_other"", ""scam_type"": {""primary_category"": ""Financial Fraud"", ""subcategory"": ""Wire Fraud""}, ""red_flags"": {""communication"": [""Multiple financial institutions claim no knowledge of funds."", ""Customer repeatedly contacted banks to trace funds.""], ""financial"": [""Funds deducted from bank accounts."", ""Money disappeared without being received by the intended recipient."", ""Conflicting information from financial institutions.""], ""job_posting"": [], ""hiring_process"": [], ""work_activity"": []}, ""financial_risk"": {""level"": ""High"", ""potential_loss"": ""{[AMOUNT]}"", ""explanation"": ""The complaint indicates direct loss of funds, with amounts deducted from accounts and money disappearing without delivery to the intended recipient.""}, ""confidence"": 95}",90
17249374,2025-12-03T20:56:32.157509,1558,"{""scam_probability"": 95, ""is_job_related"": false, ""category"": ""scam_other"", ""scam_type"": {""primary_category"": ""business scams"", ""subcategory"": ""fake check scam""}, ""red_flags"": {""communication"": [""The scammer provided a fake persona and a supposed business project to gain trust.""], ""financial"": [""The scammer issued a cashier's check for an amount greater than the agreed-upon retainer."", ""The scammer requested the victim to wire money to a third party for 'electronics' and an 'additional item'."", ""The cashier's check was discovered to be fake, leading to an overdraft in the victim's bank account."", ""The scammer attempted to re-engage with a new, unexplained cashier's check."", ""The scammer assured the victim the issue would be resolved by the next business day, which did not happen.""], ""job_posting"": [], ""hiring_process"": [], ""work_activity"": []}, ""financial_risk"": {""level"": ""Critical"", ""potential_loss"": ""The victim has already wired money and is facing an overdraft. The potential loss is the wired amount plus any bank fees and the original retainer amount if not recovered."", ""explanation"": ""The victim has already wired funds and experienced a bank overdraft due to the fake check. The risk is significant as the scammer aims to extract more money.""}, ""confidence"": 100}",95
17035302,2025-12-03T20:56:33.041628,1876,"{""scam_probability"": 0, ""is_job_related"": false, ""category"": ""not_scam_irrelevant"", ""scam_type"": {}, ""red_flags"": {""communication"": [], ""financial"": [], ""job_posting"": [], ""hiring_process"": [], ""work_activity"": []}, ""financial_risk"": {""level"": ""N/A"", ""potential_loss"": ""N/A"", ""explanation"": ""N/A""}, ""confidence"": 100}",0
17218217,2025-12-03T20:56:33.182671,1370,"{""scam_probability"": 0, ""is_job_related"": false, ""category"": ""not_scam_irrelevant"", ""scam_type"": {""primary_category"": ""N/A"", ""subcategory"": ""N/A""}, ""red_flags"": {""communication"": [], ""financial"": [], ""job_posting"": [], ""hiring_process"": [], ""work_activity"": []}, ""financial_risk"": {""level"": ""N/A"", ""potential_loss"": ""N/A"", ""explanation"": ""N/A""}, ""confidence"": 100}",0
17027700,2025-12-03T20:57:26.522987,1227,"{""scam_probability"": 10, ""is_job_related"": false, ""category"": ""not_scam_irrelevant"", ""scam_type"": {""primary_category"": ""N/A"", ""subcategory"": ""N/A""}, ""red_flags"": {""communication"": [], ""financial"": [], ""job_posting"": [], ""hiring_process"": [], ""work_activity"": []}, ""financial_risk"": {""level"": ""N/A"", ""potential_loss"": ""N/A"", ""explanation"": ""N/A""}, ""confidence"": 100}",10
17275369,2025-12-03T20:57:27.006093,986,"{""scam_probability"": 20, ""is_job_related"": false, ""category"": ""scam_other"", ""scam_type"": {""primary_category"": ""business_scams"", ""subcategory"": ""N/A""}, ""red_flags"": {""communication"": [""Refusing all communication"", ""Not answering emails"", ""Blocked from support groups/pages"", ""No human response or escalation"", ""No explanation provided""], ""financial"": [""Withholding business funds"", ""Account frozen, blocked from withdrawals"", ""Sudden freeze without reason"", ""Locked out of accessing funds"", ""Serious and immediate financial harm""], ""job_posting"": [], ""hiring_process"": [], ""work_activity"": []}, ""financial_risk"": {""level"": ""Critical"", ""potential_loss"": ""{[AMOUNT]}"", ""explanation"": ""The complaint explicitly states that a significant amount of business funds are being withheld and the business account is frozen, preventing any withdrawals. This directly impacts the operational and financial health of the business.""}, ""confidence"": 95}",20
16975074,2025-12-03T20:57:27.823769,614,"{""scam_probability"": 10, ""is_job_related"": false, ""category"": ""scam_other"", ""scam_type"": {""primary_category"": ""Financial Mark Scams"", ""subcategory"": ""Unknown""}, ""red_flags"": {""communication"": [], ""financial"": [""Fraudulent charges"", ""Unauthorized withdrawals""], ""job_posting"": [], ""hiring_process"": [], ""work_activity"": []}, ""financial_risk"": {""level"": ""Critical"", ""potential_loss"": ""XXXX + XXXX XXXX"", ""explanation"": ""The user experienced multiple fraudulent charges on two different bank accounts, leading to significant financial loss and requiring account closure.""}, ""confidence"": 95}",10
17041587,2025-12-03T20:57:28.430692,410,"{""scam_probability"": 95, ""is_job_related"": false, ""category"": ""scam_other"", ""scam_type"": {""primary_category"": ""service scams"", ""subcategory"": ""N/A""}, ""red_flags"": {""communication"": [""not communicating with me very well""], ""financial"": [""sent a picture of a receipt saying {[AMOUNT]} paid instead of the {[AMOUNT]} I sent him which means he added on money for some odd reason"", ""bank denied my claim and still til this day havent received my money back""], ""job_posting"": [], ""hiring_process"": [], ""work_activity"": []}, ""financial_risk"": {""level"": ""High"", ""potential_loss"": ""{[AMOUNT]}"", ""explanation"": ""The consumer paid for a part that was never received, and the service provider is not communicating effectively. The provider also presented a fraudulent receipt with an inflated amount, indicating further deceptive practices. The bank was unable to recover the funds, suggesting the funds may be lost.""}, ""confidence"": 98}",95
17082264,2025-12-03T20:57:29.157173,543,"{""scam_probability"": 95, ""is_job_related"": false, ""category"": ""scam_other"", ""scam_type"": {""primary_category"": ""Wire Fraud"", ""subcategory"": ""N/A""}, ""red_flags"": {""communication"": [""Spoofing of official department number (XXXX sheriffs department)""], ""financial"": [""Threatened with arrest to make payment"", ""Payment sent via Zelle"", ""Bank (Wells Fargo) refused to cancel/recover payment despite immediate attempt and notice of fraud""], ""job_posting"": [], ""hiring_process"": [], ""work_activity"": []}, ""financial_risk"": {""level"": ""High"", ""potential_loss"": ""{[AMOUNT]}"", ""explanation"": ""The complaint explicitly states a financial loss of {[AMOUNT]} due to a fraudulent transaction, and the bank's inability to recover the funds indicates a high financial risk.""}, ""confidence"": 98}",95
17027562,2025-12-03T20:57:30.180694,816,"{""scam_probability"": 95, ""is_job_related"": false, ""category"": ""scam_other"", ""scam_type"": {""primary_category"": ""wire fraud"", ""subcategory"": ""N/A""}, ""red_flags"": {""communication"": [""Unsolicited text message claiming to be from bank"", ""Request to verify via phone call"", ""Instructions to go into online banking and perform actions""], ""financial"": [""Instruction to transfer money"", ""Code sent for verification during transfer""], ""job_posting"": [], ""hiring_process"": [], ""work_activity"": []}, ""financial_risk"": {""level"": ""Critical"", ""potential_loss"": ""Unknown, but significant due to transfer of funds"", ""explanation"": ""The victim was tricked into transferring money under the guise of reversing a fraudulent transaction, leading to a potential loss of the transferred funds.""}, ""confidence"": 98}",95
17307317,2025-12-03T20:57:30.480332,1356,"{""scam_probability"": 100, ""is_job_related"": false, ""category"": ""scam_other"", ""scam_type"": {""primary_category"": ""wire_fraud"", ""subcategory"": ""N/A""}, ""red_flags"": {""communication"": [""Impersonation of a legitimate company (XXXX)"", ""Request to call a provided number"", ""Transfer to multiple 'colleagues'"", ""Urgency to 'refund' a mistakenly transferred amount""], ""financial"": [""Request to install remote access software (XXXX)"", ""Initiation of wire transfer from checking account"", ""Unauthorized transfer out of account"", ""Inability to retrieve funds""], ""job_posting"": [], ""hiring_process"": [], ""work_activity"": []}, ""financial_risk"": {""level"": ""Critical"", ""potential_loss"": ""{[AMOUNT]}"", ""explanation"": ""The victim lost a significant amount of money due to a wire transfer initiated under fraudulent pretenses, with funds confirmed as unavailable for return.""}, ""confidence"": 100}",100
17169208,2025-12-03T20:57:31.046884,174,"{""scam_probability"": 0, ""is_job_related"": false, ""category"": ""not_scam_irrelevant"", ""scam_type"": {""primary_category"": ""N/A"", ""subcategory"": ""N/A""}, ""red_flags"": {""communication"": [], ""financial"": [], ""job_posting"": [], ""hiring_process"": [], ""work_activity"": []}, ""financial_risk"": {""level"": ""N/A"", ""potential_loss"": ""N/A"", ""explanation"": ""N/A""}, ""confidence"": 100}",0
17260065,2025-12-03T20:57:33.456867,3015,"{""scam_probability"": 0, ""is_job_related"": false, ""category"": ""not_scam_irrelevant"", ""scam_type"": {}, ""red_flags"": {""communication"": [], ""financial"": [], ""job_posting"": [], ""hiring_process"": [], ""work_activity"": []}, ""financial_risk"": {""level"": ""N/A"", ""potential_loss"": ""N/A"", ""explanation"": ""N/A""}, ""confidence"": 100}",0
16992893,2025-12-03T20:57:34.073075,1435,"{""scam_probability"": 98, ""is_job_related"": true, ""category"": ""scam_job"", ""scam_type"": {""primary_category"": ""Financial Mark Scams"", ""subcategory"": ""Investment Scam""}, ""red_flags"": {""communication"": [""Communication through a manager and group chat guiding transactions.""], ""financial"": [""Instruction to purchase cryptocurrency and send to company wallets for investment tasks."", ""Funds were taken after an 'incorrect trade'."", ""Demands for additional payments (credit score points, unlock frozen account, obtain a XXXX) to release funds."", ""New fees or tasks were added every time payment was made."", ""Inability to withdraw supposed account balance.""], ""job_posting"": [""Initial job involved watching and subscribing to XXXX videos for payment.""], ""hiring_process"": [], ""work_activity"": []}, ""financial_risk"": {""level"": ""Critical"", ""potential_loss"": ""N/A"", ""explanation"": ""The victim was instructed to invest increasing amounts of money in cryptocurrency, with new fees and tasks continually being introduced, preventing withdrawal of funds. This indicates a high likelihood of significant financial loss, potentially all invested funds.""}, ""confidence"": 95}",98
17193793,2025-12-03T20:57:35.145449,1570,"{""scam_probability"": 95, ""is_job_related"": false, ""category"": ""scam_other"", ""scam_type"": {""primary_category"": ""Financial Mark Scams"", ""subcategory"": ""Impersonation Scam""}, ""red_flags"": {""communication"": [""Caller ID spoofing (number identifying as USAA)"", ""Urgency to \""refund\"" money""], ""financial"": [""Unauthorized deduction from account"", ""Request to \""enter a phone number for refund\"""", ""Financial loss after interaction""], ""job_posting"": [], ""hiring_process"": [], ""work_activity"": []}, ""financial_risk"": {""level"": ""High"", ""potential_loss"": ""{[AMOUNT]}"", ""explanation"": ""The user was tricked into authorizing a transaction that drained their account, leading to a negative balance. The dispute process failed to recover the lost funds.""}, ""confidence"": 98}",95
17196888,2025-12-03T20:57:35.325302,207,"{""scam_probability"": 95, ""is_job_related"": false, ""category"": ""scam_other"", ""scam_type"": {""primary_category"": ""scam_other"", ""subcategory"": ""romance scam""}, ""red_flags"": {""communication"": [""bot accounts"", ""not real people""], ""financial"": [""stealing money""], ""job_posting"": [], ""hiring_process"": [], ""work_activity"": []}, ""financial_risk"": {""level"": ""Critical"", ""potential_loss"": ""N/A"", ""explanation"": ""The complaint explicitly states money was stolen and identifies it as a romance scam with bot accounts, indicating a high risk of significant financial loss.""}, ""confidence"": 100}",95
17089556,2025-12-03T20:58:26.689390,221,"{""scam_probability"": 85, ""is_job_related"": false, ""category"": ""scam_other"", ""scam_type"": {""primary_category"": ""service scam"", ""subcategory"": ""online marketplace fraud""}, ""red_flags"": {""communication"": [""Seller unable to provide shipping number""], ""financial"": [""Payment made through PayPal for a product"", ""Product not received after payment""], ""job_posting"": [], ""hiring_process"": [], ""work_activity"": []}, ""financial_risk"": {""level"": ""Medium"", ""potential_loss"": ""Amount paid for the product"", ""explanation"": ""The consumer paid for a product that was not delivered, and the seller is unresponsive or unable to provide proof of shipment. This indicates a potential loss of the funds paid.""}, ""confidence"": 90}",85
17046297,2025-12-03T20:58:27.116368,703,"{""scam_probability"": 60, ""is_job_related"": false, ""category"": ""scam_other"", ""scam_type"": {""primary_category"": ""Financial Mark Scams"", ""subcategory"": ""Unauthorized Transactions""}, ""red_flags"": {""communication"": [""Hung up on"", ""Transferred to multiple departments"", ""Received nothing in response to requests""], ""financial"": [""Unauthorized direct pay to business account"", ""Significant amount of money stolen"", ""Bank claims transaction was authorized despite customer's denial""], ""job_posting"": [], ""hiring_process"": [], ""work_activity"": []}, ""financial_risk"": {""level"": ""Critical"", ""potential_loss"": ""{[AMOUNT]}"", ""explanation"": ""The consumer reported a significant amount of money stolen from their business account via unauthorized direct pay, and the bank has denied their claim, potentially leaving the consumer to bear the full loss.""}, ""confidence"": 90}",60
17280602,2025-12-03T20:58:28.204400,1028,"{""scam_probability"": 100, ""is_job_related"": false, ""category"": ""scam_other"", ""scam_type"": {""primary_category"": ""wire fraud"", ""subcategory"": ""N/A""}, ""red_flags"": {""communication"": [], ""financial"": [""Wire transfer was used to receive funds."", ""Received funds into a Citibank account named XXXX XXXX XXXX."", ""Victim seeking reversal of funds.""], ""job_posting"": [], ""hiring_process"": [], ""work_activity"": []}, ""financial_risk"": {""level"": ""Critical"", ""potential_loss"": ""{[AMOUNT]}"", ""explanation"": ""The victim lost a significant amount of money to a wire fraud scam, with the funds sent via wire transfer to a specific bank account.""}, ""confidence"": 100}",100
16972121,2025-12-03T20:58:28.258957,1603,"{""scam_probability"": 95, ""is_job_related"": false, ""category"": ""scam_other"", ""scam_type"": {""primary_category"": ""financial"", ""subcategory"": ""wire fraud""}, ""red_flags"": {""communication"": [""Bank employees observed the customer was visibly distressed."", ""Bank employees noted inconsistencies in wire instructions.""], ""financial"": [""Coerced into wiring money under pressure from impersonating authorities."", ""Bank seized remaining balance of approximately {[AMOUNT]} after the fraud occurred."", ""Customer has been unable to access own money for nearly XXXX months.""], ""job_posting"": [], ""hiring_process"": [], ""work_activity"": []}, ""financial_risk"": {""level"": ""Critical"", ""potential_loss"": ""{[AMOUNT]}"", ""explanation"": ""The complaint describes being coerced into wiring a significant amount of money due to an international fraud scheme. The bank then froze and seized the remaining balance, leaving the customer without access to their funds for an extended period. This indicates a high risk of significant financial loss.""}, ""confidence"": 98}",95
17163492,2025-12-03T20:58:29.366486,2442,"{""scam_probability"": 100, ""is_job_related"": false, ""category"": ""scam_other"", ""scam_type"": {""primary_category"": ""wire_fraud"", ""subcategory"": ""N/A""}, ""red_flags"": {""communication"": [""Wells Fargo has not responded or provided any documentation or restitution.""], ""financial"": [""recipient withdrew or transferred all funds and closed the Wells Fargo account"", ""ongoing financial hardship, including difficulty maintaining mortgage obligations and other credit payments""], ""job_posting"": [], ""hiring_process"": [], ""work_activity"": []}, ""financial_risk"": {""level"": ""Critical"", ""potential_loss"": ""{[AMOUNT]}"", ""explanation"": ""The consumer initiated a wire transfer of a significant amount to a fraudulent recipient account, resulting in the complete loss of funds. This has caused severe financial hardship.""}, ""confidence"": 100}",100
